{
  "schema_version": "ui_conformance_telegram_readback_receipt_v1",
  "chat_id": -1004337049383,
  "topic_root_message_id": 1030,
  "message_id": 1127,
  "message_link": "https://t.me/c/4337049383/1127",
  "supersedes_message_id": null,
  "case_id": "component.listing.page-date-header.tomorrow.desktop",
  "run_id": "date-header-tomorrow-current-20260824-v1",
  "local_image_sha256": "8fb2df1e77cceb6607d7ac862b7b9025908121b4861823e306d0aa5814c0b5af",
  "caption_sha256": "e2217b70ff98d8d33490e0b0a31fc6448d207d668d50c0e1ce5957c0949c971c",
  "content_hash": "ca23cf1e628c7bdd603f4395626144128669a43296d07161cbfb8b985dc62ba6",
  "telegram_media_metadata": {
    "kind": "MessageMediaPhoto",
    "has_media": true,
    "caption_exact": true,
    "reply_to_message_id": 1030
  },
  "sent_at": "2026-08-24T00:54:48.506798Z",
  "read_back_at": "2026-08-24T00:54:48.647848Z",
  "read_back_status": "verified"
}
