{
  "schema_version": "ui_conformance_telegram_readback_receipt_v1",
  "chat_id": -1004337049383,
  "topic_root_message_id": 1030,
  "message_id": 1089,
  "message_link": "https://t.me/c/4337049383/1089",
  "supersedes_message_id": null,
  "case_id": "date-listing-shell-v1-typical-desktop",
  "run_id": "date-listing-shell-v1-typical-desktop-diagnostic-20260823-v1",
  "local_image_sha256": "77cb5cc5b78d1a654d3df223bfcfd48c481c8112ed5bd7fd2e52a70a8d07923c",
  "caption_sha256": "6e097fedcbc16009bd386a530ee8e13a4738c4d844d98d2b724d2ce73a5763ff",
  "content_hash": "970a69978af68c864d217151bcbd419e0baa5e00ce3fbb0c146ac75102723a12",
  "telegram_media_metadata": {
    "kind": "MessageMediaPhoto",
    "has_media": true,
    "caption_exact": true,
    "reply_to_message_id": 1030
  },
  "sent_at": "2026-08-23T08:48:12.327462Z",
  "read_back_at": "2026-08-23T08:48:13.296222Z",
  "read_back_status": "verified"
}
