{
  "schema_version": "ui_conformance_telegram_readback_receipt_v1",
  "chat_id": -1004337049383,
  "topic_root_message_id": 1030,
  "message_id": 1131,
  "message_link": "https://t.me/c/4337049383/1131",
  "supersedes_message_id": 1129,
  "case_id": "component.shell.desktop-header.root.tomorrow",
  "run_id": "desktop-header-root57-current-20260824-v2",
  "local_image_sha256": "d0692f02c1eede207be9718ddc52bd5158c3cd61e0e2e119d467cbbe32cbb225",
  "caption_sha256": "1858565b43bd17d4b595e17c2417e3b91f67da8ee50aa16f6a3b7159feb265fa",
  "content_hash": "6a8db677297d599d12f1207f3703d6034df2368a25750f4b97643e01cd8bb8f1",
  "telegram_media_metadata": {
    "kind": "MessageMediaPhoto",
    "has_media": true,
    "caption_exact": true,
    "reply_to_message_id": 1030
  },
  "sent_at": "2026-08-24T01:25:09.568948Z",
  "read_back_at": "2026-08-24T01:25:09.717713Z",
  "read_back_status": "verified"
}
